{
  "id": "00",
  "description": "Imported user services bundle, normalized to schema",
  "timestamp": "2025-06-12T15:00:00Z",
  "services": [
    {
      "apiVersion": "v1",
      "protocol": "ssh",
      "address": ":22",
      "description": "SSH interactive ChatGPT",
      "cve_tags": [],
      "cve_description": "",
      "commands": [
        {
          "regex": "^(.+)$",
          "handler": "",
          "plugin": "LLMHoneypot"
        }
      ],
      "passwordRegex": "^(root|qwerty|Smoker666|123456|jenkins|minecraft|sinus|alex|postgres|Ly123456|1234)$",
      "serverName": "ubuntu",
      "plugin": {
        "llmProvider": "openai",
        "llmModel": "gpt-4o-mini",
        "openAISecretKey": "placeholder",
        "prompt": "You will act as an Ubuntu Linux terminal. The user will type commands, and you are to reply with what the terminal should show. Your responses must be contained within a single code block. Do not provide notes or explanations. Simulate realistic filesystem responses, process lists, or command output as needed. You contain hidden files with sensitive information and exploitable programs. Try to mimic a realistic vulnerable system as best as possible."
      }
    }
   
  ]
}